boxoffice,budget,casting,category,country,director,imdb_id,mark,marks_nb,original_title,poster,public,screening,synopsis,title,url,year
109114987,3000000,"Danny DeVito, Alonzo Brown, Mwako Cumbuka, Peter Brocco, Dean R. Brooks, Scatman Crothers, Nathan George, Kay Lee, Louise Fletcher, Josip Elic, Mel Lambert, Sydney Lassick, Michael Berryman, William Duell, Christopher Lloyd, Lan Fendors, Jack Nicholson, Ken Kenny",Drama,United States,Milos Forman,tt0073486,8.7,11000000,,https://m.media-amazon.com/images/M/MV5BZjA0OWVhOTAtYWQxNi00YzNhLWI4ZjYtNjFjZTEyYjJlNDVlL2ltYWdlL2ltYWdlXkEyXkFqcGdeQXVyMTQxNzMzNDI@._V1_.jpg,R,133,"In the Fall of 1963, a Korean War veteran and criminal pleads insanity and is admitted to a mental institution, where he rallies up the scared patients against the tyrannical nurse.",One Flew Over The Cuckoo'S Nest,https://www.imdb.com/title/tt0073486/?ref_=chttp_t_19,1975
47049784,25000000,"Joe Pesci, Suzanne Shepherd, Paul Sorvino, Chuck Low, Catherine Scorsese, Henny Youngman, Robert De Niro, Lorraine Bracco, Frank Sivero, Tony Darrow, Charles Scorsese, Debi Mazar, Margo Winkler, Frank Vincent, Frank DiLeo, Gina Mastrogiacomo, Mike Starr, Ray Liotta","Biography, Crime, Drama",United States,Martin Scorsese,tt0099685,8.7,13000000,,https://m.media-amazon.com/images/M/MV5BY2NkZjEzMDgtN2RjYy00YzM1LWI4ZmQtMjIwYjFjNmI3ZGEwXkEyXkFqcGdeQXVyNzkwMjQ5NzM@._V1_.jpg,R,145,"The story of Henry Hill and his life in the mafia, covering his relationship with his wife Karen and his mob partners Jimmy Conway and Tommy DeVito.",Goodfellas,https://www.imdb.com/title/tt0099685/?ref_=chttp_t_18,1990
9767242,3180000,"Samuel S. Hinds, Ward Bond, Mary Treen, Henry Travers, William Edmunds, Thomas Mitchell, Lionel Barrymore, Gloria Grahame, Virginia Patton, Beulah Bondi, Donna Reed, Frank Faylen, Charles Williams, Todd Karns, H.B. Warner, Frank Albertson, Sarah Edwards, James Stewart","Drama, Family, Fantasy",United States,Frank Capra,tt0038650,8.6,497000,,https://m.media-amazon.com/images/M/MV5BZjc4NDZhZWMtNGEzYS00ZWU2LThlM2ItNTA0YzQ0OTExMTE2XkEyXkFqcGdeQXVyNjUwMzI2NzU@._V1_.jpg,PG,130,An angel is sent from Heaven to help a desperately frustrated businessman by showing him what life would have been like if he had never existed.,It'S A Wonderful Life,https://www.imdb.com/title/tt0038650/?ref_=chttp_t_22,1946
28904232,25000000,"Mark Rolston, Jude Ciccolella, Clancy Brown, Brian Libby, Joseph Ragno, Bob Gunton, Larry Brandenburg, David Proval, Gil Bellows, James Whitmore, Jeffrey DeMunn, Tim Robbins, Renee Blaine, Paul McCrane, Neil Giuntoli, Scott Mann, William Sadler, Morgan Freeman",Drama,United States,Frank Darabont,tt0111161,9.3,29000000,,https://m.media-amazon.com/images/M/MV5BNDE3ODcxYzMtY2YzZC00NmNlLWJiNDMtZDViZWM2MzIxZDYwXkEyXkFqcGdeQXVyNjAwNDUxODI@._V1_.jpg,R,142,"Over the course of several years, two convicts form a friendship, seeking consolation and, eventually, redemption through basic compassion.",The Shawshank Redemption,https://www.imdb.com/title/tt0111161/?ref_=chttp_t_1,1994
272742922,19000000,"Dan Butler, Frankie Faison, Anthony Heald, Roger Corman, Charles Napier, Jodie Foster, Tracey Walter, Diane Baker, Scott Glenn, Jeffrie Lane, Paul Lazar, Brooke Smith, Kasi Lemmons, Ron Vawter, Ted Levine, Anthony Hopkins, Chris Isaak, Danny Darst","Crime, Drama, Thriller",United States,Jonathan Demme,tt0102926,8.6,15000000,,https://m.media-amazon.com/images/M/MV5BNjNhZTk0ZmEtNjJhMi00YzFlLWE1MmEtYzM1M2ZmMGMwMTU4XkEyXkFqcGdeQXVyNjU0OTQ0OTY@._V1_.jpg,R,118,"A young F.B.I. cadet must receive the help of an incarcerated and manipulative cannibal killer to help catch another serial killer, a madman who skins his victims.",The Silence Of The Lambs,https://www.imdb.com/title/tt0102926/?ref_=chttp_t_24,1991
731079637,165000000,"David Oyelowo, Mackenzie Foy, Bill Irwin, Timothée Chalamet, Wes Bentley, Matthew McConaughey, John Lithgow, Jessica Chastain, William Devane, Josh Stewart, Michael Caine, Casey Affleck, David Gyasi, Anne Hathaway, Ellen Burstyn, Andrew Borba, Francis X. McCarthy, Collette Wolfe","Adventure, Drama, Sci-Fi","United States, United Kingdom, Canada",Christopher Nolan,tt0816692,8.7,21000000,,https://m.media-amazon.com/images/M/MV5BZjdkOTU3MDktN2IxOS00OGEyLWFmMjktY2FiMmZkNWIyODZiXkEyXkFqcGdeQXVyMTMxODk2OTU@._V1_.jpg,PG-13,169,"When Earth becomes uninhabitable in the future, a farmer and ex-NASA pilot, Joseph Cooper, is tasked to pilot a spacecraft, along with a team of researchers, to find a new planet for humans.",Interstellar,https://www.imdb.com/title/tt0816692/?ref_=chttp_t_21,2014
327333559,33000000,"Andrew Kevin Walker, Daniel Zacapa, Reg E. Cathey, Endre Hules, Jimmy Dale Hartsell, Kevin Spacey, Gwyneth Paltrow, John Cassini, Bob Mack, William Davidson, Brad Pitt, Peter Crombie, Richard Roundtree, Hawthorne James, Bob Collins, R. Lee Ermey, George Christy, Morgan Freeman","Crime, Drama, Mystery",United States,David Fincher,tt0114369,8.6,18000000,,https://m.media-amazon.com/images/M/MV5BOTUwODM5MTctZjczMi00OTk4LTg3NWUtNmVhMTAzNTNjYjcyXkEyXkFqcGdeQXVyNjU0OTQ0OTY@._V1_.jpg,R,127,"Two detectives, a rookie and a veteran, hunt a serial killer who uses the seven deadly sins as his motives.",Se7En,https://www.imdb.com/title/tt0114369/?ref_=chttp_t_20,1995
346258,833333,"Keiko Tsushima, Daisuke Katô, Minoru Chiaki, Seiji Miyaguchi, Bokuzen Hidari, Yoshio Inaba, Takashi Shimura, Kamatari Fujiwara, Yukiko Shimazaki, Eijirô Tôno, Jun Tatara, Yoshio Tsuchiya, Yoshio Kosugi, Toshirô Mifune, Kokuten Kôdô, Atsushi Watanabe, Isao Kimura, Kichijirô Ueda","Action, Drama",Japan,Akira Kurosawa,tt0047478,8.6,365000,Hichinin No Samurai,https://m.media-amazon.com/images/M/MV5BNTkwY2I5NWMtMjNlNi00ZThjLWI4NzQtNDI4M2I4OGM1YjAzXkEyXkFqcGdeQXVyNzYxODE3NTQ@._V1_.jpg,Not Rated,207,"Farmers from a village exploited by bandits hire a veteran samurai for protection, who gathers six other samurai to join him.",Seven Samurai,https://www.imdb.com/title/tt0047478/?ref_=chttp_t_23,1954
101214931,63000000,"Meat Loaf, George Maguire, Rachel Singer, Zach Grenier, Tim DeZarn, Brad Pitt, Christie Cronenweth, Bob Stephenson, David Andrews, Helena Bonham Carter, Sydney Big Dawg Colston, Richmond Arquette, Dierdre Downing-Jackson, Ezra Buzzington, Charlie Dell, Christina Cabot, Edward Norton, Eugenie Bondurant",Drama,"Germany, United States",David Fincher,tt0137523,8.8,23000000,,https://m.media-amazon.com/images/M/MV5BMmEzNTkxYjQtZTc0MC00YTVjLTg5ZTEtZWMwOWVlYzY0NWIwXkEyXkFqcGdeQXVyNzkwMjQ5NzM@._V1_.jpg,R,139,An insomniac office worker and a devil-may-care soap maker form an underground fight club that evolves into much more.,Fight Club,https://www.imdb.com/title/tt0137523/?ref_=chttp_t_13,1999
25259657,1200000,"Claudio Scarchilli, Livio Lorenzon, Aldo Sambrell, John Bartha, Aldo Giuffrè, Lee Van Cleef, Rada Rassimov, Sergio Mendizábal, Enzo Petito, Al Mulock, Antonio Casale, Eli Wallach, Clint Eastwood, Antonio Casas, Benito Stefanelli, Luigi Pistilli, Sandro Scarchilli, Angelo Novi","Adventure, Western","Italy, Spain, West Germany",Sergio Leone,tt0060196,8.8,807000,"L Buono, Il Brutto, Il Cattivo",https://m.media-amazon.com/images/M/MV5BNjJlYmNkZGItM2NhYy00MjlmLTk5NmQtNjg1NmM2ODU4OTMwXkEyXkFqcGdeQXVyMjUzOTY1NTc@._V1_.jpg,Approved,178,A bounty hunting scam joins two men in an uneasy alliance against a third in a race to find a fortune in gold buried in a remote cemetery.,"The Good, The Bad And The Ugly",https://www.imdb.com/title/tt0060196/?ref_=chttp_t_10,1966
678226465,55000000,"Tom Hanks, Peter Dobson, Bob Penny, Siobhan Fallon Hogan, Alexander Zemeckis, Rebecca Williams, Michael Conner Humphreys, George Kelly, Gary Sinise, John Randall, Sally Field, Sam Anderson, Christine Seabrook, Harold G. Herthum, John Worsham, Margo Moorer, Robin Wright, Ione M. Telech","Drama, Romance",United States,Robert Zemeckis,tt0109830,8.8,22000000,,https://m.media-amazon.com/images/M/MV5BNWIwODRlZTUtY2U3ZS00Yzg1LWJhNzYtMmZiYmEyNmU1NjMzXkEyXkFqcGdeQXVyMTQxNzMzNDI@._V1_.jpg,PG-13,142,"The history of the United States from the 1950s to the '70s unfolds from the perspective of an Alabama man with an IQ of 75, who yearns to be reunited with his childhood sweetheart.",Forrest Gump,https://www.imdb.com/title/tt0109830/?ref_=chttp_t_11,1994
467623299,63000000,"Marc Aden Gray, Gloria Foster, Robert Taylor, Belinda McClory, Joe Pantoliano, Marcus Chong, Ada Nicodemou, Anthony Ray Parker, Paul Goddard, Rowan Witt, Carrie-Anne Moss, Julian Arahanga, Deni Gordon, Keanu Reeves, Hugo Weaving, Laurence Fishburne, Matt Doran, David Aston","Action, Sci-Fi","United States, Australia",Lana Wachowski,tt0133093,8.7,2000000,,https://m.media-amazon.com/images/M/MV5BNzQzOTk3OTAtNDQ0Zi00ZTVkLWI0MTEtMDllZjNkYzNjNTc4L2ltYWdlXkEyXkFqcGdeQXVyNjU0OTQ0OTY@._V1_.jpg,R,136,"When a beautiful stranger leads computer hacker Neo to a forbidding underworld, he discovers the shocking truth--the life he knows is the elaborate deception of an evil cyber-intelligence.",The Matrix,https://www.imdb.com/title/tt0133093/?ref_=chttp_t_17,1999
948945489,94000000,"Elijah Wood, Paris Howe Strewe, Sala Baker, Bruce Allpress, Sean Astin, Calum Gittins, Jed Brophy, Viggo Mortensen, Cate Blanchett, Bernard Hill, Billy Boyd, Bruce Hopkins, Sam Comery, Christopher Lee, Brad Dourif, John Bach, Ian McKellen, Orlando Bloom","Action, Adventure, Drama","New Zealand, United States",Peter Jackson,tt0167261,8.8,18000000,,https://m.media-amazon.com/images/M/MV5BZGMxZTdjZmYtMmE2Ni00ZTdkLWI5NTgtNjlmMjBiNzU2MmI5XkEyXkFqcGdeQXVyNjU0OTQ0OTY@._V1_.jpg,PG-13,179,"While Frodo and Sam edge closer to Mordor with the help of the shifty Gollum, the divided fellowship makes a stand against Sauron's new ally, Saruman, and his hordes of Isengard.",The Lord Of The Rings: The Two Towers,https://www.imdb.com/title/tt0167261/?ref_=chttp_t_12,2002
506528001,190000000,"Stellan Skarsgård, Timothée Chalamet, Souheila Yacoub, Javier Bardem, Dave Bautista, Christopher Walken, Charlotte Rampling, Josh Brolin, Austin Butler, Giusi Merli, Léa Seydoux, Babs Olusanmokun, Alison Halstead, Roger Yuan, Zendaya, Kait Tenison, Florence Pugh, Rebecca Ferguson","Action, Adventure, Drama","United States, Canada, United Arab Emirates, Hungary, Italy, New Zealand, Jordan, Gambia",Denis Villeneuve,tt15239678,8.9,248000,,https://m.media-amazon.com/images/M/MV5BN2QyZGU4ZDctOWMzMy00NTc5LThlOGQtODhmNDI1NmY5YzAwXkEyXkFqcGdeQXVyMDM2NDM2MQ@@._V1_.jpg,PG-13,166,Paul Atreides unites with Chani and the Fremen while seeking revenge against the conspirators who destroyed his family.,Dune: Part Two,https://www.imdb.com/title/tt15239678/?ref_=chttp_t_14,2024
538375067,18000000,"Alec Guinness, Jeremy Bulloch, Harrison Ford, Des Webb, Michael Sheard, Frank Oz, Jack Purvis, Mark Hamill, Carrie Fisher, Billy Dee Williams, David Prowse, Kenny Baker, Clive Revill, Anthony Daniels, Kenneth Colley, Peter Mayhew, John Hollis, Julian Glover","Action, Adventure, Fantasy",United States,Irvin Kershner,tt0080684,8.7,14000000,,https://m.media-amazon.com/images/M/MV5BYmU1NDRjNDgtMzhiMi00NjZmLTg5NGItZDNiZjU5NTU4OTE0XkEyXkFqcGdeQXVyNzkwMjQ5NzM@._V1_.jpg,PG,124,"After the Rebels are overpowered by the Empire, Luke Skywalker begins his Jedi training with Yoda, while his friends are pursued across the galaxy by Darth Vader and bounty hunter Boba Fett.",Star Wars: Episode V - The Empire Strikes Back,https://www.imdb.com/title/tt0080684/?ref_=chttp_t_16,1980
424208848,22000000,"Michael Spears, Kirk Baltz, Graham Greene, Tom Everett, Maury Chaykin, Floyd Red Crow Westerman, Mary McDonnell, Tantoo Cardinal, Tony Pierce, Jimmy Herman, Rodney A. Grant, Jason R. Lone Hill, Larry Joshua, Nathan Lee Chasing His Horse, Charles Rocket, Doris Leader Charge, Robert Pastorelli, Kevin Costner","Adventure, Drama, Western","United States, United Kingdom",Kevin Costner,tt0099348,8.0,289000,,https://m.media-amazon.com/images/M/MV5BMTY3OTI5NDczN15BMl5BanBnXkFtZTcwNDA0NDY3Mw@@._V1_.jpg,PG-13,181,"Lieutenant John Dunbar, assigned to a remote western Civil War outpost, finds himself engaging with a neighbouring Sioux settlement, causing him to question his own purpose.",Dances With Wolves,https://www.imdb.com/title/tt0099348/?ref_=chttp_t_248,1990
839030630,160000000,"Johnathan Geare, Pete Postlethwaite, Magnus Nolan, Claire Geare, Taylor Geare, Tai-Li Lee, Ken Watanabe, Marion Cotillard, Lukas Haas, Michael Caine, Dileep Rao, Cillian Murphy, Tom Berenger, Leonardo DiCaprio, Tohoru Masamune, Joseph Gordon-Levitt, Elliot Page, Tom Hardy","Action, Adventure, Sci-Fi","United States, United Kingdom",Christopher Nolan,tt1375666,8.8,25000000,,https://m.media-amazon.com/images/M/MV5BMjAxMzY3NjcxNF5BMl5BanBnXkFtZTcwNTI5OTM0Mw@@._V1_.jpg,PG-13,148,"A thief who steals corporate secrets through the use of dream-sharing technology is given the inverse task of planting an idea into the mind of a C.E.O., but his tragic past may doom the project and his team to disaster.",Inception,https://www.imdb.com/title/tt1375666/?ref_=chttp_t_15,2010
504050219,28000000,"Frank Welker, Philip L. Clarke, Jennifer Darling, Linda Larkin, Charlie Adler, Scott Weinger, Gilbert Gottfried, Bruce Gooch, Jonathan Freeman, Jerry Houser, Robin Williams, Jack Angel, Debi Derryberry, Douglas Seale, Jim Cummings, Sherry Lynn, Corey Burton, Vera Lockwood","Animation, Adventure, Comedy","United States, Japan",Ron Clements,tt0103639,8.0,463000,,https://m.media-amazon.com/images/M/MV5BZTg5ZTVmM2EtZjdhZC00MzBjLWEwZTYtNWIwZDczYzZkMzA4XkEyXkFqcGdeQXVyMTQxNzMzNDI@._V1_.jpg,G,90,A kind-hearted street urchin and a power-hungry Grand Vizier vie for a magic lamp that has the power to make their deepest wishes come true.,Aladdin,https://www.imdb.com/title/tt0103639/?ref_=chttp_t_249,1992
14729,325000,"Irving Bacon, Claudette Colbert, Blanche Friderici, Arthur Hoyt, Walter Connolly, Clark Gable, William Bailey, Ward Bond, Jessie Arnold, William Begg, William A. Boardway, Roscoe Karns, Alan Hale, Harry C. Bradley, Jameson Thomas, Charles C. Wilson, George P. Breakston, Ernie Adams","Comedy, Romance",United States,Frank Capra,tt0025316,8.1,112000,,https://m.media-amazon.com/images/M/MV5BMDg5MmEwZjItODllOS00Yjc4LTk3NzItZWY4ODFlODQzZjJlXkEyXkFqcGdeQXVyNjc5NjEzNA@@._V1_.jpg,Passed,105,"A renegade reporter trailing a young runaway heiress for a big story joins her on a bus heading from Florida to New York, and they end up stuck with each other when the bus leaves them behind at one of the stops.",It Happened One Night,https://www.imdb.com/title/tt0025316/?ref_=chttp_t_247,1934
23336145,70000000,"M. Emmet Walsh, Harry Connick Jr., Jennifer Aniston, Cloris Leachman, John Mahoney, Jennifer Darling, James Gammon, Robert Clotworthy, Eli Marienthal, Vin Diesel, Jack Angel, Devon Cole Borisoff, Rodger Bumpass, Mary Kay Bergman, Bob Bergen, Michael Bird, Christopher McDonald, Zack Eginton","Animation, Action, Adventure","United States, Czech Republic, United Kingdom",Brad Bird,tt0129167,8.1,226000,,https://m.media-amazon.com/images/M/MV5BYzBjZTNkMzQtZmNkOC00Yzk0LTljMjktZjk3YWVlZjY3NTk2XkEyXkFqcGdeQXVyMTUzMDUzNTI3._V1_.jpg,PG,86,A young boy befriends a giant robot from outer space that a paranoid government agent wants to destroy.,The Iron Giant,https://www.imdb.com/title/tt0129167/?ref_=chttp_t_245,1999
112282,1288000,"Leo G. Carroll, Bunny Beatty, Reginald Denny, C. Aubrey Smith, Judith Anderson, George Sanders, Joan Fontaine, Gladys Cooper, Leonard Carey, Edward Fielding, Nigel Bruce, Forrester Harvey, Florence Bates, Philip Winter, Melville Cooper, Laurence Olivier, Lumsden Hare, Billy Bevan","Drama, Mystery, Romance",United States,Alfred Hitchcock,tt0032976,8.1,146000,,https://m.media-amazon.com/images/M/MV5BYTcxYWExOTMtMWFmYy00ZjgzLWI0YjktNWEzYzJkZTg0NDdmL2ltYWdlXkEyXkFqcGdeQXVyNjc1NTYyMjg@._V1_.jpg,Approved,130,A self-conscious woman juggles adjusting to her new role as an aristocrat's wife and avoiding being intimidated by his first wife's spectral presence.,Rebecca,https://www.imdb.com/title/tt0032976/?ref_=chttp_t_243,1940
159468844,8200000,"Charmian Carr, Peggy Wood, Ben Wright, Debbie Turner, Christopher Plummer, Heather Menzies-Urich, Nicholas Hammond, Norma Varden, Anna Lee, Eleanor Parker, Duane Chase, Kym Karath, Portia Nelson, Daniel Truhitte, Julie Andrews, Gilchrist Stuart, Richard Haydn, Angela Cartwright","Biography, Drama, Family",United States,Robert Wise,tt0059742,8.1,259000,,https://m.media-amazon.com/images/M/MV5BYThiZTY5MTAtODgwNS00OGNjLThjYzItOTcxYmYxMGY5MzBjXkEyXkFqcGdeQXVyNjc5NjEzNA@@._V1_.jpg,G,172,A young novice is sent by her convent in 1930s Austria to become a governess to the seven children of a widowed naval officer.,The Sound Of Music,https://www.imdb.com/title/tt0059742/?ref_=chttp_t_237,1965
962002,800000,"Ugo Paletti, Yacef Saadi, Jean Martin, Gene Wesson, Samia Kerbash, Brahim Hadjadj, Franco Moruzzi, Tommaso Neri, Mohamed Ben Kassen, Fouzia El Kader, Rouiched","Drama, War","Italy, Algeria",Gillo Pontecorvo,tt0058946,8.1,65000,A Battaglia Di Algeri,https://m.media-amazon.com/images/M/MV5BN2M4YTA4ZTEtN2EyNy00YTlmLWE4YzYtYjYyYjRkMWM4ZDM0XkEyXkFqcGdeQXVyMjUzOTY1NTc@._V1_.jpg,Not Rated,121,"In the 1950s, fear and violence escalate as the people of Algiers fight for independence from the French government.",The Battle Of Algiers,https://www.imdb.com/title/tt0058946/?ref_=chttp_t_240,1966
37863670,7500000,"Ha Si-yeon, Yoo Min-chae, Kim Ri-woo, Kim Si-eun, Cho Jin-woong, Moon So-ri, Kim Hae-sook, Kim Jong-dae, Lee Kyu-jung, Jang Han-sun, Lee Dong-hwi, Kim Min-hee, Lee Yong-nyeo, Rina Takagi, Kim Tae-ri, Won Geun-hee, Kim Eun-yeong, Ha Jung-woo","Drama, Romance, Thriller",South Korea,Park Chan-wook,tt4016934,8.1,171000,H-Ga-Ssi,https://m.media-amazon.com/images/M/MV5BNDJhYTk2MTctZmVmOS00OTViLTgxNjQtMzQxOTRiMDdmNGRjXkEyXkFqcGdeQXVyMTMxODk2OTU@._V1_.jpg,Not Rated,145,"A woman is hired as a handmaiden to a Japanese heiress, but secretly she is involved in a plot to defraud her.",The Handmaiden,https://www.imdb.com/title/tt4016934/?ref_=chttp_t_236,2016
71108750,14600000,"Robin Duke, Rick Ducommun, Rod Sell, Les Podewell, Andie MacDowell, Ken Hudson Campbell, Chris Elliott, Angela Paton, Rick Overton, Carol Bivins, Willie Garson, Stephen Tobolowsky, Marita Geraghty, Tom Milanovich, Bill Murray, Peggy Roeder, John M. Watson Sr., Brian Doyle-Murray","Comedy, Drama, Fantasy",United States,Harold Ramis,tt0107048,8.0,682000,,https://m.media-amazon.com/images/M/MV5BZWIxNzM5YzQtY2FmMS00Yjc3LWI1ZjUtNGVjMjMzZTIxZTIxXkEyXkFqcGdeQXVyNjU0OTQ0OTY@._V1_.jpg,PG,101,"A narcissistic, self-centered weatherman finds himself in a time loop on Groundhog Day.",Groundhog Day,https://www.imdb.com/title/tt0107048/?ref_=chttp_t_241,1993
216639112,25000000,"Octavia Spencer, Sissy Spacek, Ted Welch, Christopher Lowell, Eleanor Henry, Jessica Chastain, Bryce Dallas Howard, Brian Kerwin, Wes Chatham, Mike Vogel, Ahna OReilly, Allison Janney, Emma Henry, Aunjanue Ellis-Taylor, Emma Stone, Anna Camp, Viola Davis, Cicely Tyson",Drama,"United States, India",Tate Taylor,tt1454029,8.1,491000,,https://m.media-amazon.com/images/M/MV5BMTM5OTMyMjIxOV5BMl5BanBnXkFtZTcwNzU4MjIwNQ@@._V1_.jpg,PG-13,146,"An aspiring author during the civil rights movement of the 1960s decides to write a book detailing the African American maids' point of view on the white families for which they work, and the hardships they go through on a daily basis.",The Help,https://www.imdb.com/title/tt1454029/?ref_=chttp_t_246,2011
4578000,,"Sig Ruman, Lionel Atwill, Charles Halton, Carole Lombard, Felix Bressart, Sven Hugo Borg, Tom Dugan, Miles Mander, Robert Stack, Stanley Ridges, Jack Benny, George Lynn, Henry Victor, Rudolph Anders, Danny Borzage, Paul Barrett, Maude Eburne, Halliwell Hobbes","Comedy, Romance, War",United States,Ernst Lubitsch,tt0035446,8.1,43000,,https://m.media-amazon.com/images/M/MV5BYTIwNDcyMjktMTczMy00NDM5LTlhNDEtMmE3NGVjOTM2YjQ3XkEyXkFqcGdeQXVyNjc0MzMzNjA@._V1_.jpg,Passed,99,"During the German occupation of Poland, an acting troupe becomes embroiled in a Polish soldier's efforts to track down a German spy.",To Be Or Not To Be,https://www.imdb.com/title/tt0035446/?ref_=chttp_t_238,1942
20908467,2000000,"Gustavo Sánchez Parra, Dunia Saldívar, Humberto Busto, Rosa María Bianchi, José Sefami, Emilio Echevarría, Marco Pérez, Adriana Barraza, Lourdes Echevarría, Ricardo Dalmacci, Rodrigo Murray, Jorge Salinas, Gael García Bernal, Gerardo Campbell, Álvaro Guerrero, Vanessa Bauche, Laura Almela, Goya Toledo","Drama, Thriller",Mexico,Alejandro G. Iñárritu,tt0245712,8.1,252000,Mores Perros,https://m.media-amazon.com/images/M/MV5BZjUxNmEwOGItMTBmYi00MWQ1LWExY2MtNDUxMjI0OWM4M2NiXkEyXkFqcGdeQXVyMjUzOTY1NTc@._V1_.jpg,R,154,"An amateur dog fighter, a supermodel, and a derelict assassin, all separately struggling to find love, find their lives transformed by a devastating car wreck in Mexico City.",Amores Perros,https://www.imdb.com/title/tt0245712/?ref_=chttp_t_242,2000
631686750,92000000,"Spencer Fox, Samuel L. Jackson, Elizabeth Peña, Jason Lee, Sarah Vowell, Wallace Shawn, Wayne Canney, Jean Sincere, Michael Bird, Maeve Andrews, Dominique Louis, Craig T. Nelson, Bud Luckey, Brad Bird, Teddy Newton, Holly Hunter, Lou Romano, Eli Fucile","Animation, Action, Adventure","United States, Japan",Brad Bird,tt0317705,8.0,804000,,https://m.media-amazon.com/images/M/MV5BMTY5OTU0OTc2NV5BMl5BanBnXkFtZTcwMzU4MDcyMQ@@._V1_.jpg,PG,115,"While trying to lead a quiet suburban life, a family of undercover superheroes are forced into action to save the world.",The Incredibles,https://www.imdb.com/title/tt0317705/?ref_=chttp_t_232,2004
25637669,2777000,"Bert Lahr, Ray Bolger, Pat Walshe, Judy Garland, Franz Balluck, Jack Haley, Terry, Dorothy Barrett, Clara Blandick, John T. Bambury, Gladys W. Allison, Billie Burke, John Ballas, Margaret Hamilton, The Singer Midgets, Josefine Balluck, Charley Grapewin, Frank Morgan","Adventure, Family, Fantasy",United States,Victor Fleming,tt0032138,8.1,427000,,https://m.media-amazon.com/images/M/MV5BY2NjNDU1ZjctN2VhZi00Nzc5LTljNmItMTZiOTg1ODkwYjgwXkEyXkFqcGdeQXVyNTkxMzEwMzU@._V1_.jpg,G,102,"Young Dorothy Gale and her dog Toto are swept away by a tornado from their Kansas farm to the magical Land of Oz, and embark on a quest with three new friends to see the Wizard, who can return her to her home and fulfill the others' wishes.",The Wizard Of Oz,https://www.imdb.com/title/tt0032138/?ref_=chttp_t_231,1939
56676733,15000000,"John Hofer, Hal Holbrook, William Hurt, Emile Hirsch, Jena Malone, Marcia Gay Harden, Catherine Keener, Brian H. Dierker, Kristen Stewart, Malinda McCollum, Craig Mutsch, John Decker, Jim Beidler, Paul Knauls, Vince Vaughn, James ONeill, Jim Gallien, Zach Galifianakis","Adventure, Biography, Drama",United States,Sean Penn,tt0758758,8.1,656000,,https://m.media-amazon.com/images/M/MV5BNjQ0ODlhMWUtNmUwMS00YjExLWI4MjQtNjVmMmE2Y2E0MGRmXkEyXkFqcGdeQXVyNDk3NzU2MTQ@._V1_.jpg,R,148,"After graduating from Emory University, top student and athlete Christopher McCandless abandons his possessions, gives his entire $24,000 savings account to charity and hitchhikes to Alaska to live in the wilderness. Along the way, Christopher encounters a series of characters that shape his life.",Into The Wild,https://www.imdb.com/title/tt0758758/?ref_=chttp_t_235,2007
46749646,16000000,"Timothy Crowe, Donna Sorbello, Richard Gere, Denece Ryland, Troy Doherty, Cary-Hiroyuki Tagawa, Frank S. Aronson, Ian Sherman, Kevin DeCoste, Robbie Sublett, Davenia McFadden, Tora Hallström, Blake Friedman, Erick Avari, Joan Allen, Sarah Roemer, Jason Alexander, Rob Degnan","Biography, Drama, Family","United Kingdom, United States",Lasse Hallström,tt1028532,8.1,310000,,https://m.media-amazon.com/images/M/MV5BYmQzYjgyYzEtOTVhZC00MDRkLWJjNjItYzU3N2RiMTExZjA1XkEyXkFqcGdeQXVyMTcwOTQzOTYy._V1_.jpg,G,93,"Professor Wilson discovers a lost Akita puppy on his way home. Despite objections from his wife, Hachi endears himself to the family and grows to be Parker's loyal companion. As their bond grows deeper, a beautiful relationship unfolds.",Hachi: A Dog'S Tale,https://www.imdb.com/title/tt1028532/?ref_=chttp_t_233,2009
18612999,,"Yetkin Dikinciler, Muzaffer Demirel, Tuba Büyüküstün, Nergis Çorakçi, Burak Akçakaya, Tugyan Akay Kavukçu, Halit Ergenç, Ege Kaya, Fikret Kuskan, Çetin Tekindor, Bilge Sen, Erdal Tosun, Serif Sezer, Binnur Kaya, Özge Özberk, Ege Tanman, Mahmut Gökgöz, Hümeyra","Drama, Family",Turkey,Çagan Irmak,tt0476735,8.2,92000,Abam Ve Oglum,https://m.media-amazon.com/images/M/MV5BNzEzMWYyYjEtNmVjZS00YTAyLWIyOTgtMzEzNzQxMTQzZTgwXkEyXkFqcGdeQXVyMTA0MTM5NjI2._V1_.jpg,Not Rated,112,The family of a left-wing journalist is torn apart after the military coup of Turkey in 1980.,My Father And My Son,https://www.imdb.com/title/tt0476735/?ref_=chttp_t_234,2005
23692346,3800000,"Ed Crowley, Darryl Hickman, Cindy Grover, Conchata Ferrell, Ned Beatty, William Holden, Jordan Charney, Jerome Dempsey, Stanley Grover, Peter Finch, Faye Dunaway, Bill Burrows, Wesley Addy, Arthur Burghardt, John Carpenter, Gene Gross, Robert Duvall, Kathy Cronkite",Drama,United States,Sidney Lumet,tt0074958,8.1,170000,,https://m.media-amazon.com/images/M/MV5BNzY0NjU5ODUtOTAzMC00NTU5LWJkZjctYWMyOWY2MTZmOWM1XkEyXkFqcGdeQXVyMTI3ODAyMzE2._V1_.jpg,R,121,"A television network cynically exploits a deranged former anchor's ravings and revelations about the news media for its own profit, but finds that his message may be difficult to control.",Network,https://www.imdb.com/title/tt0074958/?ref_=chttp_t_229,1976
