episode_length,mark,marks_nb,nb_episodes,nb_seasons,synopsis,title,url,years
24m,8.6,145K,66,4,"A family is attacked by demons and only two members survive - Tanjiro and his sister Nezuko, who is turning into a demon slowly. Tanjiro sets out to become a demon slayer to avenge his famil...",Demon Slayer: Kimetsu no Yaiba,https://www.imdb.com/title/tt9335498/?ref_=chttvtp_i_159,2019– 
22m,8.6,165K,144,14,Covert black ops and espionage take a back seat to zany personalities and relationships between secret agents and drones.,Archer,https://www.imdb.com/title/tt1486217/?ref_=chttvtp_i_158,2009–2023
1h 10m,8.7,41K,19,,The absolute top secret love story of a chaebol heiress who made an emergency landing in North Korea because of a paragliding accident and a North Korean special officer who falls in love wi...,Crash Landing on You,https://www.imdb.com/title/tt10850932/?ref_=chttvtp_i_157,2019–2020
1h,8.6,33K,26,3,"In the New York of the late '80s and early '90s, this is a story of ball culture and the gay and trans community, the raging AIDS crisis, and capitalism.",Pose,https://www.imdb.com/title/tt7562112/?ref_=chttvtp_i_155,2018–2021
3h,8.6,47K,6,,"In the Regency era, Mr E. Blackadder serves as butler to the foppish numskull Prince George amidst the fads and crazes of the time.",Blackadder the Third,https://www.imdb.com/title/tt0092324/?ref_=chttvtp_i_154,1987
25m,8.6,132K,15,,"Bumbling, childlike Mr. Bean has trouble completing the simplest of day-to-day tasks, but his perseverance and resourcefulness frequently allow him to find ingenious ways around problems.",Mr. Bean,https://www.imdb.com/title/tt0096657/?ref_=chttvtp_i_153,1990–1995
1h 32m,8.6,26K,199,11,"In the not-too-distant future Joel Robinson is held captive by Dr. Forrester and TV's Frank, forced to watch B-Grade movies on the Satellite of Love with the help of his robot friends: Cambo...",Mystery Science Theater 3000,https://www.imdb.com/title/tt0094517/?ref_=chttvtp_i_156,1988–1999
55m,8.6,44K,58,5,Ciro disregards tradition in his attempt to become the next boss of his crime syndicate. The internal power struggle puts him and his entire family's life at risk.,Gomorrah,https://www.imdb.com/title/tt2049116/?ref_=chttvtp_i_152,2014–2021
1h 40m,8.6,52K,70,13,"Hercule Poirot, a famous Belgian detective, who has an impeccable knack for getting embroiled in a mystery, solves crimes along with Captain Hastings and Scotland Yard Chief Inspector James ...",Poirot,https://www.imdb.com/title/tt0094525/?ref_=chttvtp_i_150,1989–2013
,8.6,39K,10,,Oscar-winning producer Albert S. Ruddy's never-before-revealed experiences of making The Godfather (1972).,The Offer,https://www.imdb.com/title/tt13111040/?ref_=chttvtp_i_151,2022
,8.7,13K,13,2,"Sherlock Holmes and Dr Watson solve the mysteries of the devil's foot, Silver Blaze, Wisteria Lodge and the Bruce-Partington Plans.",The Return of Sherlock Holmes,https://www.imdb.com/title/tt0090509/?ref_=chttvtp_i_149,1986–1988
24m,8.7,35K,89,4,"Determined to be like the volleyball championship's star player nicknamed ""the small giant"", Shoyo joins his school's volleyball club.",Haikyu!!,https://www.imdb.com/title/tt3398540/?ref_=chttvtp_i_148,2014–2020
30m,9.0,25K,12,2,Set in the summer of 1998 it is a story about conflicting emotions towards family members from the eyes of a twelve year old.,Yeh Meri Family,https://www.imdb.com/title/tt8595766/?ref_=chttvtp_i_146,2018–2023
1h,8.6,332K,19,2,"In the late 1970s, two FBI agents broaden the realm of criminal science by investigating the psychology behind murder and end up getting too close to real-life monsters.",Mindhunter,https://www.imdb.com/title/tt5290382/?ref_=chttvtp_i_147,2017–2019
6h 24m,8.7,26K,4,,Two former Texas Rangers renew their spirit of adventure as they and several other residents of a small Texas town join a cattle drive to the Montana Territory.,Lonesome Dove,https://www.imdb.com/title/tt0096639/?ref_=chttvtp_i_145,1989
54m,8.6,472K,39,3,"A blind lawyer by day, vigilante by night. Matt Murdock fights the crime of New York as Daredevil.",Daredevil,https://www.imdb.com/title/tt3322312/?ref_=chttvtp_i_143,2015–2018
1h,8.6,76K,38,4,"When a body is found on the bridge between Denmark and Sweden, right on the border, Danish inspector Martin Rohde and Swedish Saga Norén have to share jurisdiction and work together to find ...",The Bridge,https://www.imdb.com/title/tt1733785/?ref_=chttvtp_i_142,2011–2018
11m,8.6,111K,289,10,"A 12-year-old boy and his best friend, a wise 28-year-old dog with magical powers, go on a series of surreal adventures in a remote future.",Adventure Time,https://www.imdb.com/title/tt1305826/?ref_=chttvtp_i_140,2010–2018
,8.7,37K,5,,The lives of a group of friends living in 1980s London are irreparably changed by the AIDS crisis.,It's a Sin,https://www.imdb.com/title/tt9140342/?ref_=chttvtp_i_139,2021
2h 56m,8.6,50K,6,,"In the Tudor court of Elizabeth I, Lord Edmund Blackadder strives to win Her Majesty's favour while attempting to avoid a grisly fate should he offend her.",Blackadder II,https://www.imdb.com/title/tt0088484/?ref_=chttvtp_i_144,1986
22m,8.7,20K,21,3,A caveman and a dinosaur bond over shared tragedy and work together to survive in a perilous prehistoric world.,Primal,https://www.imdb.com/title/tt10332508/?ref_=chttvtp_i_138,2019– 
3h,9.2,12K,412,3,"A live weekly show in which a band of professional voice actors improvise, role-play, and roll their way through an epic Dungeons and Dragons campaign.",Critical Role,https://www.imdb.com/title/tt4834232/?ref_=chttvtp_i_137,2015– 
45m,8.6,248K,217,11,"Two F.B.I. Agents, Fox Mulder the believer and Dana Scully the skeptic, investigate the strange and unexplained, while hidden forces work to impede their efforts.",The X-Files,https://www.imdb.com/title/tt0106179/?ref_=chttvtp_i_134,1993–2018
55m,8.7,761K,96,8,"He's smart. He's lovable. He's Dexter Morgan, America's favorite serial killer, who spends his days solving crimes and nights committing them.",Dexter,https://www.imdb.com/title/tt0773262/?ref_=chttvtp_i_135,2006–2013
4h 39m,8.6,51K,12,2,"Filmmaker Andrew Jarecki examines the complicated life of reclusive real estate icon Robert Durst, the key suspect in a series of unsolved crimes.",The Jinx: The Life and Deaths of Robert Durst,https://www.imdb.com/title/tt4299972/?ref_=chttvtp_i_141,2015–2024
24m,8.7,79K,54,2,"After being given a mysterious power to control others, an outcast prince becomes the masked leader of the rebellion against an all-powerful empire.",Code Geass,https://www.imdb.com/title/tt0994314/?ref_=chttvtp_i_136,2006–2008
55m,8.6,117K,36,3,"A show set in the late 1800s, revolving around the characters of Deadwood, South Dakota; a town of deep corruption and crime.",Deadwood,https://www.imdb.com/title/tt0348914/?ref_=chttvtp_i_133,2004–2006
58m,8.6,255K,60,6,Follows the political rivalries and romances of Queen Elizabeth II's reign and the events that shaped Britain for the second half of the 20th century.,The Crown,https://www.imdb.com/title/tt4786824/?ref_=chttvtp_i_132,2016–2023
22m,8.6,286K,124,7,The absurd antics of an Indiana town's public officials as they pursue sundry projects to make their city a better place.,Parks and Recreation,https://www.imdb.com/title/tt1266020/?ref_=chttvtp_i_131,2009–2015
30m,8.6,87K,41,4,"Earn and his cousin, Alfred, try to make their way in the world through Atlanta's rap scene. Along the way they come face-to-face with social and economic issues touching on race, relationsh...",Atlanta,https://www.imdb.com/title/tt4288182/?ref_=chttvtp_i_130,2016–2022
25m,8.7,44K,25,3,"Three misfit priests and their housekeeper live on Craggy Island, not the peaceful and quiet part of Ireland that it seems to be.",Father Ted,https://www.imdb.com/title/tt0111958/?ref_=chttvtp_i_129,1995–1998
45m,8.7,158K,106,6,"A heartwarming and emotional story about a unique set of triplets, their struggles, and their wonderful parents.",This Is Us,https://www.imdb.com/title/tt5555260/?ref_=chttvtp_i_126,2016–2022
30m,8.7,13K,18,3,An anxious New Yorker attempts to give everyday advice while dealing with his own personal issues.,How to with John Wilson,https://www.imdb.com/title/tt10801534/?ref_=chttvtp_i_127,2020–2023
24m,8.7,44K,75,,"Tenma, a brilliant neurosurgeon with a promising future, risks his career to save the life of a critically wounded young boy. The boy, now a charismatic young man, reappears 9 years later in...",Monster,https://www.imdb.com/title/tt0434706/?ref_=chttvtp_i_124,2004–2005
,8.6,529K,73,6,A Congressman works with his equally conniving wife to exact revenge on the people who betrayed him.,House of Cards,https://www.imdb.com/title/tt1856010/?ref_=chttvtp_i_125,2013–2018
29m,8.7,26K,24,4,The Minister for Social Affairs is continually harassed by Number 10's policy enforcer and dependent on his not-so-reliable team of civil servants.,The Thick of It,https://www.imdb.com/title/tt0459159/?ref_=chttvtp_i_123,2005–2012
30m,9.0,24K,78,,"An adaptation of the ancient epic in which the exiled Prince Rama and his brother Laxman set out to save Rama's wife, Sita, who has been kidnapped by the demon king of Lanka Ravana.",Ramayan,https://www.imdb.com/title/tt0268093/?ref_=chttvtp_i_128,1987–1988
,8.7,114K,10,,"The post-Civil war generation of the Dutton family travels to Texas, and joins a wagon train undertaking the arduous journey west to Oregon, before settling in Montana to establish what woul...",1883,https://www.imdb.com/title/tt13991232/?ref_=chttvtp_i_122,2021–2022
24m,8.7,165K,501,,"Naruto Uzumaki, is a loud, hyperactive, adolescent ninja who constantly searches for approval and recognition, as well as to become Hokage, who is acknowledged as the leader and strongest of...",Naruto: Shippuden,https://www.imdb.com/title/tt0988824/?ref_=chttvtp_i_121,2007–2017
1h,8.7,69K,37,7,"Drama series following the investigations of AC-12, a controversial police anti-corruption unit.",Line of Duty,https://www.imdb.com/title/tt2303687/?ref_=chttvtp_i_119,2012–2021
1h 30m,8.9,33K,105,4,An inharmonious police team in Ankara Police Force and its discredited police chief fight crime.,Behzat Ç: An Ankara Detective Story,https://www.imdb.com/title/tt1795096/?ref_=chttvtp_i_118,2010–2019
30m,8.9,18K,79,2,"The show revolves around the lives of the members of an Uber Wealthy - High Society Gujarati family of Cuffe Parade - South Mumbai, whose daughter-in-law is from a middle class Delhi backgro...",Sarabhai V/S Sarabhai,https://www.imdb.com/title/tt1518542/?ref_=chttvtp_i_116,2004–2017
1h,8.7,126K,328,33,"The hosts talk about everything car-related. From new cars to how they're fueled, this show has it all.",Top Gear,https://www.imdb.com/title/tt1628033/?ref_=chttvtp_i_120,2002–2022
44m,8.7,72K,76,5,"A drama that follows the lives of the Dillon Panthers, one of the nation's best high school football teams, and their head coach Eric Taylor.",Friday Night Lights,https://www.imdb.com/title/tt0758745/?ref_=chttvtp_i_115,2006–2011
,9.2,310K,10,2,It is the story of the journey of three UPSC (public service competitive exams in India) aspirants and their friendship against all odds.,Aspirants,https://www.imdb.com/title/tt14392248/?ref_=chttvtp_i_114,2021– 
23m,8.7,20K,39,3,A continuation of the Justice League animated series finds the original members of the team joined in their battle against crime and evil by dozens of other heroes from the DC comics univers...,Justice League Unlimited,https://www.imdb.com/title/tt6025022/?ref_=chttvtp_i_113,2004–2006
,8.7,142K,43,5,"After her husband leaves her, young mother of two Miriam ""Midge"" Maisel discovers that she has a talent for stand-up comedy. Could this be her calling?",The Marvelous Mrs. Maisel,https://www.imdb.com/title/tt5788792/?ref_=chttvtp_i_111,2017–2023
,8.7,24K,13,2,"Sherlock Holmes and Dr Watson solve the mysteries of copper beeches, a Greek interpreter, the Norwood builder, a resident patient, the red-headed league, and one final problem.",The Adventures of Sherlock Holmes,https://www.imdb.com/title/tt0086661/?ref_=chttvtp_i_110,1984–1985
40m,8.7,582K,25,4,"The travels of a lone bounty hunter in the outer reaches of the galaxy, far from the authority of the New Republic.",The Mandalorian,https://www.imdb.com/title/tt8111088/?ref_=chttvtp_i_117,2019– 
1h,8.7,83K,46,5,"Jeremy, Richard and James embark on an adventure across the globe, driving new and exciting automobiles from manufacturers all over the world.",The Grand Tour,https://www.imdb.com/title/tt5712554/?ref_=chttvtp_i_112,2016–2024
45m,8.9,23K,94,,"When a dynastic struggle between the collateral branches of the Kuru clan, the Kauravas and Pandavas lead them to the threshold of war, Lord Krishna decides to step in and take control of th...",Mahabharat,https://www.imdb.com/title/tt0158417/?ref_=chttvtp_i_109,1988–1990
25m,8.7,66K,54,9,Mark and Jez are a couple of twenty-something roommates who have nothing in common - except for the fact that their lives are anything but normal. Mayhem ensues as the pair strive to cope wi...,Peep Show,https://www.imdb.com/title/tt0387764/?ref_=chttvtp_i_106,2003–2015
,8.7,193K,18,3,An adult animated series based on the Skybound/Image comic about a teenager whose father is the most powerful superhero on the planet.,Invincible,https://www.imdb.com/title/tt6741278/?ref_=chttvtp_i_105,2021– 
44m,8.7,135K,176,7,"Set almost 100 years after Captain Kirk's 5-year mission, a new generation of Starfleet officers sets off in the U.S.S. Enterprise-D on its own mission to go where no one has gone before.",Star Trek: The Next Generation,https://www.imdb.com/title/tt0092455/?ref_=chttvtp_i_107,1987–1994
,8.7,259K,92,7,"A drama about one of New York's most prestigious ad agencies at the beginning of the 1960s, focusing on one of the firm's most mysterious but extremely talented ad executives, Donald Draper.",Mad Men,https://www.imdb.com/title/tt0804503/?ref_=chttvtp_i_104,2007–2015
51m,8.7,1.3M,42,5,"When a young boy vanishes, a small town uncovers a mystery involving secret experiments, terrifying supernatural forces and one strange little girl.",Stranger Things,https://www.imdb.com/title/tt4574334/?ref_=chttvtp_i_108,2016–2025
24m,8.7,184K,25,2,"The story of Saitama, a hero that does it just for fun & can defeat his enemies with a single punch.",One Punch Man,https://www.imdb.com/title/tt4508902/?ref_=chttvtp_i_103,2015–2019
55m,8.7,195K,19,2,"Mark leads a team of office workers whose memories have been surgically divided between their work and personal lives. When a mysterious colleague appears outside of work, it begins a journe...",Severance,https://www.imdb.com/title/tt11280740/?ref_=chttvtp_i_102,2022– 
23m,8.7,52K,25,,"Guts, a wandering mercenary, joins the Band of the Hawk after being defeated in a duel by Griffith, the group's leader and founder. Together, they dominate every battle, but something menaci...",Berserk,https://www.imdb.com/title/tt0318871/?ref_=chttvtp_i_99,1997–1998
22m,8.7,434K,763,36,The satiric adventures of a working-class family in the misfit city of Springfield.,The Simpsons,https://www.imdb.com/title/tt0096697/?ref_=chttvtp_i_98,1989–2025
,8.7,508K,176,8,"Using a crack team of doctors and his wits, an antisocial maverick doctor specializing in diagnostic medicine does whatever it takes to solve puzzling cases that come his way.",House,https://www.imdb.com/title/tt0412142/?ref_=chttvtp_i_101,2004–2012
,8.7,224K,52,6,A chronicle of the lives of the British aristocratic Crawley family and their servants in the early twentieth century.,Downton Abbey,https://www.imdb.com/title/tt1606375/?ref_=chttvtp_i_97,2010–2015
47m,8.7,88K,89,7,Drama series following the lives and cases of dirty cop Vic Mackey and the corrupt LAPD unit under his command.,The Shield,https://www.imdb.com/title/tt0286486/?ref_=chttvtp_i_96,2002–2008
22m,8.7,323K,84,5,"Level-headed son Michael Bluth takes over family affairs after his father is imprisoned. But the rest of his spoiled, dysfunctional family are making his job unbearable.",Arrested Development,https://www.imdb.com/title/tt0367279/?ref_=chttvtp_i_100,2003–2019
44m,8.7,175K,74,4,"When an old enemy, the Cylons, resurface and obliterate the 12 colonies, the crew of the aged Galactica protect a small civilian fleet - the last of humanity - as they journey toward the fab...",Battlestar Galactica,https://www.imdb.com/title/tt0407362/?ref_=chttvtp_i_95,2004–2009
,8.7,198K,12,2,Series adapted from the award-winning play about a young woman trying to cope with life in London whilst coming to terms with a recent tragedy.,Fleabag,https://www.imdb.com/title/tt5687612/?ref_=chttvtp_i_94,2016–2019
1h,8.7,640K,32,4,A group of vigilantes set out to take down corrupt superheroes who abuse their superpowers.,The Boys,https://www.imdb.com/title/tt1190634/?ref_=chttvtp_i_93,2019– 
24m,9.0,35K,27,2,"The peace is suddenly broken when warning sirens blare through the Soul Society. Residents are disappearing without a trace and nobody knows who's behind it. Meanwhile, a darkness is approac...",Bleach: Thousand-Year Blood War,https://www.imdb.com/title/tt14986406/?ref_=chttvtp_i_92,2022– 
,8.7,439K,26,3,"A family saga with a supernatural twist, set in a German town where the disappearance of two young children exposes the relationships among four families.",Dark,https://www.imdb.com/title/tt5753856/?ref_=chttvtp_i_91,2017–2020
,8.7,61K,9,2,"Driven by a dream of revenge against those who made her an outcast in Edo-period Japan, a young warrior cuts a bloody path toward her destiny.",Blue Eye Samurai,https://www.imdb.com/title/tt13309742/?ref_=chttvtp_i_90,2023
24m,8.8,73K,26,,"After discovering time travel, a university student and his colleagues must use their knowledge of it to stop an evil organization and their diabolical plans.",Steins;Gate,https://www.imdb.com/title/tt1910272/?ref_=chttvtp_i_89,2011–2015
55m,8.7,106K,56,6,A series chronicling the daily activities of an unusual prison facility and its criminal inhabitants.,Oz,https://www.imdb.com/title/tt0118421/?ref_=chttvtp_i_88,1997–2003
,8.9,84K,24,3,"A comedy-drama, which captures the journey of an engineering graduate Abhishek, who for lack of a better job option joins as secretary of a Panchayat office in a remote village of Uttar Prad...",Panchayat,https://www.imdb.com/title/tt12004706/?ref_=chttvtp_i_87,2020– 
,8.7,184K,22,2,A down-to-earth account of the lives of both illustrious and ordinary Romans set in the last days of the Roman Republic.,Rome,https://www.imdb.com/title/tt0384766/?ref_=chttvtp_i_86,2005–2007
,8.8,641K,36,6,"A gangster family epic set in 1900s England, centering on a gang who sew razor blades in the peaks of their caps, and their fierce boss Tommy Shelby.",Peaky Blinders,https://www.imdb.com/title/tt2442560/?ref_=chttvtp_i_84,2013–2022
50m,8.7,509K,11,2,"After a global pandemic destroys civilization, a hardened survivor takes charge of a 14-year-old girl who may be humanity's last hope.",The Last of Us,https://www.imdb.com/title/tt3581920/?ref_=chttvtp_i_83,2023– 
,9.1,21K,16,4,"Set in quaint by-lanes in the heart of India, Gullak is a collection of disarming and relatable tales of the Mishra family.",Gullak,https://www.imdb.com/title/tt10530900/?ref_=chttvtp_i_82,2019– 
24m,8.8,69K,48,2,"Following a tragedy, Thorfinn embarks on a journey with the man responsible for it to take his life in a duel as a true and honorable warrior to pay homage.",Vinland Saga,https://www.imdb.com/title/tt10233448/?ref_=chttvtp_i_80,2019–2023
,9.0,80K,11,3,"Dedicated to Shrimati SL Loney ji, Shri Irodov ji and Maanniya HC Verma ji, 'Kota Factory' is TVF's latest original. India's first 'Black and White' show highlights the problems present day ...",Kota Factory,https://www.imdb.com/title/tt9432978/?ref_=chttvtp_i_81,2019–2021
11m,8.8,70K,10,,Two brothers find themselves lost in a mysterious land and try to find their way home.,Over the Garden Wall,https://www.imdb.com/title/tt3718778/?ref_=chttvtp_i_79,2014
22m,8.7,404K,330,30,"Follows the misadventures of four irreverent grade-schoolers in the quiet, dysfunctional town of South Park, Colorado.",South Park,https://www.imdb.com/title/tt0121955/?ref_=chttvtp_i_77,1997– 
,8.8,342K,34,3,"American college football coach Ted Lasso heads to London to manage AFC Richmond, a struggling English Premier League soccer team.",Ted Lasso,https://www.imdb.com/title/tt10986410/?ref_=chttvtp_i_78,2020–2023
1h,8.7,635K,33,7,"Featuring stand-alone dramas -- sharp, suspenseful, satirical tales that explore techno-paranoia -- ""Black Mirror"" is a contemporary reworking of ""The Twilight Zone"" with stories that tap in...",Black Mirror,https://www.imdb.com/title/tt2085059/?ref_=chttvtp_i_76,2011– 
11h 9m,8.8,19K,13,,"The personal and governmental affairs of the Julio-Claudian dynasty at the beginning of the Roman Empire, as recalled by one of its rulers.","I, Claudius",https://www.imdb.com/title/tt0074006/?ref_=chttvtp_i_75,1976
,9.1,11K,20,,"Five childhood friends, who all live in the same Ssangmundong neighborhood of Seoul in 1988, lean on each other to survive their challenging teen years and set a path for their futures.",Reply 1988,https://www.imdb.com/title/tt5182866/?ref_=chttvtp_i_74,2015–2016
22m,8.8,71K,33,3,Comedian Dave Chappelle hosts this sketch-comedy show that parodies many of the nuances of race and culture.,Chappelle's Show,https://www.imdb.com/title/tt0353049/?ref_=chttvtp_i_72,2003–2006
49m,8.8,467K,30,3,"A chronicled look at the criminal exploits of Colombian drug lord Pablo Escobar, as well as the many other drug kingpins who plagued the country through the years.",Narcos,https://www.imdb.com/title/tt2707408/?ref_=chttvtp_i_71,2015–2017
24m,8.8,146K,277,16,"With the help of the powerful Dragonballs, a team of fighters led by the saiyan warrior Goku defend the planet earth from extraterrestrial enemies.",Dragon Ball Z,https://www.imdb.com/title/tt0214341/?ref_=chttvtp_i_70,1989–1996
2h 55m,8.8,57K,6,,"Stuck in the middle of World War I, Captain Edmund Blackadder does his best to escape the banality of the war.",Blackadder Goes Forth,https://www.imdb.com/title/tt0096548/?ref_=chttvtp_i_68,1989
,8.8,214K,30,2,An idiosyncratic FBI agent investigates the murder of a young woman in the even more idiosyncratic town of Twin Peaks.,Twin Peaks,https://www.imdb.com/title/tt0098936/?ref_=chttvtp_i_69,1990–1991
5h 27m,8.8,92K,6,,"While the arrival of wealthy gentlemen sends her marriage-minded mother into a frenzy, willful and opinionated Elizabeth Bennet matches wits with haughty Mr. Darcy.",Pride and Prejudice,https://www.imdb.com/title/tt0112130/?ref_=chttvtp_i_66,1995
1h 20m,9.1,96K,144,7,"It is an unique and heartwarming show follows the extraordinary journey of a couple named Leyla and Mecnun. With Ali Atay portraying Mecnun and Ezgi Asaroglu as Leyla, the series has garnere...",Leyla and Mecnun,https://www.imdb.com/title/tt1831164/?ref_=chttvtp_i_65,2011–2023
30m,8.8,100K,12,2,"Hotel owner Basil Fawlty's incompetence, short fuse, and arrogance form a combination that ensures accidents and trouble are never far away.",Fawlty Towers,https://www.imdb.com/title/tt0072500/?ref_=chttvtp_i_64,1975–1979
,8.8,187K,77,6,"BoJack Horseman was the star of the hit television show ""Horsin' Around"" in the '80s and '90s, but now he's washed up, living in Hollywood, complaining about everything, and wearing colorful...",BoJack Horseman,https://www.imdb.com/title/tt3398228/?ref_=chttvtp_i_63,2014–2020
24m,9.0,228K,1108,,"Monkey D. Luffy sets off on an adventure with his pirate crew in hopes of finding the greatest treasure ever, known as the ""One Piece.""",One Piece,https://www.imdb.com/title/tt0388629/?ref_=chttvtp_i_62,1999– 
28m,8.8,144K,120,12,Larry David stars as an over-the-top version of himself in this comedy series that shows how seemingly trivial details of day-to-day life can precipitate a catastrophic chain of events.,Curb Your Enthusiasm,https://www.imdb.com/title/tt0264235/?ref_=chttvtp_i_61,2000–2024
4h 53m,8.8,33K,3,,A World War II German U-Boat crew have a terrifying patrol mission in the early days of the war.,Das Boot,https://www.imdb.com/title/tt0081834/?ref_=chttvtp_i_60,1985
44m,8.9,85K,155,7,Inside the lives of staffers in the West Wing of the White House.,The West Wing,https://www.imdb.com/title/tt0200276/?ref_=chttvtp_i_59,1999–2006
30m,8.8,79K,45,4,The original surreal sketch comedy showcase for the Monty Python troupe.,Monty Python's Flying Circus,https://www.imdb.com/title/tt0063929/?ref_=chttvtp_i_58,1969–1974
22m,8.8,250K,172,18,Five friends with big egos and small brains are the proprietors of an Irish pub in Philadelphia.,It's Always Sunny in Philadelphia,https://www.imdb.com/title/tt0472954/?ref_=chttvtp_i_57,2005– 
40m,9.1,72K,10,2,A story of trials and tribulations of four young entrepreneurs who quit their day jobs in order to pursue their start up venture.,TVF Pitchers,https://www.imdb.com/title/tt4742876/?ref_=chttvtp_i_56,2015–2022
,9.0,21K,44,5,Yilmaz and Ilkkan are two friends who are constantly fighting each other. Their greatest feature is always being able to do something that will turn their ordinary lives upside down.,As If,https://www.imdb.com/title/tt13675832/?ref_=chttvtp_i_55,2021– 
,8.9,1.1M,234,10,Follows the personal and professional lives of six twenty to thirty year-old friends living in the Manhattan borough of New York City.,Friends,https://www.imdb.com/title/tt0108778/?ref_=chttvtp_i_53,1994–2004
,8.8,268K,39,4,"The Roy family is known for controlling the biggest media and entertainment company in the world. However, their world changes when their father steps down from the company.",Succession,https://www.imdb.com/title/tt7660850/?ref_=chttvtp_i_54,2018–2023
