episode_length,mark,marks_nb,nb_episodes,nb_seasons,synopsis,title,url,years
6h,8.9,17K,7,,"Africa, the world's wildest continent. David Attenborough takes us on an awe-inspiring journey through one of the most diverse places in the world. We visit deserts, savannas, and jungles an...",Africa,https://www.imdb.com/title/tt2571774/?ref_=chttvtp_i_52,2013
47m,9.0,19K,161,17,"Five comedians are set tasks challenging their creativity and wit. The tasks are supervised by Alex Horne but the Taskmaster, Greg Davies, always has the final word.",Taskmaster,https://www.imdb.com/title/tt4934214/?ref_=chttvtp_i_51,2015– 
30m,8.9,95K,346,11,Former Daily Show host and correspondent John Oliver brings his persona to this weekly news satire program.,Last Week Tonight with John Oliver,https://www.imdb.com/title/tt3530232/?ref_=chttvtp_i_50,2014– 
4h 56m,8.8,137K,4,,Five teens from Harlem become trapped in a nightmare when they're falsely accused of a brutal attack in Central Park. Based on the true story.,When They See Us,https://www.imdb.com/title/tt7137906/?ref_=chttvtp_i_49,2019
30m,8.9,38K,32,4,"Nathan Fielder uses his business degree and life experiences to help real small businesses turn a profit. But because of his unorthodox approach, Nathan's genuine efforts to do good often dr...",Nathan for You,https://www.imdb.com/title/tt2297757/?ref_=chttvtp_i_47,2013–2017
5h 12m,9.0,14K,6,,"This six-part series traces the Second World War, from the rise of the Nazis to the surrender of the Japanese, with detailed portraits of key figures.",Apocalypse: The Second World War,https://www.imdb.com/title/tt1508238/?ref_=chttvtp_i_48,2009
53m,8.9,419K,51,5,"Various chronicles of deception, intrigue, and murder in and around frozen Minnesota. All of these tales mysteriously lead back one way or another to Fargo, North Dakota.",Fargo,https://www.imdb.com/title/tt2802850/?ref_=chttvtp_i_46,2014–2024
,8.9,137K,26,,The futuristic misadventures and tragedies of an easygoing bounty hunter and his partners.,Cowboy Bebop,https://www.imdb.com/title/tt0213338/?ref_=chttvtp_i_45,1998–1999
23m,8.9,133K,41,2,"Twin siblings Dipper and Mabel Pines spend the summer at their great-uncle's tourist trap in the enigmatic Gravity Falls, Oregon.",Gravity Falls,https://www.imdb.com/title/tt1865718/?ref_=chttvtp_i_44,2012–2016
1h,9.0,47K,22,2,A man diagnosed with Alzheimer's decides to punish criminals.,Persona,https://www.imdb.com/title/tt7920978/?ref_=chttvtp_i_43,2018– 
55m,8.9,650K,31,5,"Anthology series in which police investigations unearth the personal and professional secrets of those involved, both within and outside the law.",True Detective,https://www.imdb.com/title/tt2356777/?ref_=chttvtp_i_42,2014– 
,9.0,28K,3,,"In January 1969, The Beatles set out to write and record new songs for their first live show in more than two years, culminating in an impromptu concert atop their Savile Row studio.",The Beatles: Get Back,https://www.imdb.com/title/tt9735318/?ref_=chttvtp_i_41,2021
9h 32m,8.9,28K,10,,"Ten television drama films, each one based on one of the Ten Commandments.",The Decalogue,https://www.imdb.com/title/tt0092337/?ref_=chttvtp_i_40,1989–1990
11h 20m,9.0,18K,9,,A comprehensive survey of the American Civil War.,The Civil War,https://www.imdb.com/title/tt0098769/?ref_=chttvtp_i_38,1990
22m,8.9,349K,173,9,The continuing misadventures of neurotic New York City stand-up comedian Jerry Seinfeld and his equally neurotic New York City friends.,Seinfeld,https://www.imdb.com/title/tt0098904/?ref_=chttvtp_i_39,1989–1998
24m,8.9,374K,37,,An intelligent high school student goes on a secret crusade to eliminate criminals from the world after discovering a notebook capable of killing anyone whose name is written into it.,Death Note,https://www.imdb.com/title/tt0877057/?ref_=chttvtp_i_37,2006–2007
1h 35m,9.0,56K,64,9,Comedy that follows two brothers from London's rough Peckham estate as they wheel and deal through a number of dodgy deals and search for the big score that'll make them millionaires.,Only Fools and Horses,https://www.imdb.com/title/tt0081912/?ref_=chttvtp_i_36,1981–2003
24m,9.0,132K,148,,"Gon Freecss aspires to become a Hunter, an exceptional being capable of greatness. With his friends and his potential, he seeks out his father, who left him when he was younger.",Hunter x Hunter,https://www.imdb.com/title/tt2098220/?ref_=chttvtp_i_35,2011–2014
45m,9.0,55K,18,4,Follow Jeremy Clarkson as he attempts to run a farm in the countryside.,Clarkson's Farm,https://www.imdb.com/title/tt10541088/?ref_=chttvtp_i_34,2021– 
,9.0,33K,10,,Focuses on life and the environment in both the Arctic and Antarctic.,Frozen Planet,https://www.imdb.com/title/tt2092588/?ref_=chttvtp_i_33,2011–2012
50m,9.0,28K,8,,A cinematic experience bringing you the most amazing human stories in the world. Humans and wildlife surviving in the most extreme environments on Earth,Human Planet,https://www.imdb.com/title/tt1806234/?ref_=chttvtp_i_31,2011
,9.0,281K,14,,"Five hundred years in the future, a renegade crew aboard a small spacecraft tries to survive as they travel the unknown parts of the galaxy and evade warring factions as well as authority ag...",Firefly,https://www.imdb.com/title/tt0303461/?ref_=chttvtp_i_32,2002–2003
41m,9.0,265K,10,2,"Set in Utopian Piltover and the oppressed underground of Zaun, the story follows the origins of two iconic League Of Legends champions and the power that will tear them apart.",Arcane,https://www.imdb.com/title/tt11126994/?ref_=chttvtp_i_29,2021– 
,9.0,640K,63,6,The trials and tribulations of criminal lawyer Jimmy McGill in the years leading up to his fateful run-in with Walter White and Jesse Pinkman.,Better Call Saul,https://www.imdb.com/title/tt3032476/?ref_=chttvtp_i_30,2015–2022
22m,9.0,704K,188,9,"A mockumentary on a group of typical office workers, where the workday consists of ego clashes, inappropriate behavior, and tedium.",The Office,https://www.imdb.com/title/tt0386676/?ref_=chttvtp_i_27,2005–2013
6h 29m,9.0,43K,8,,"Mammoth series, five years in the making, taking a look at the rich tapestry of life in the world's oceans.",The Blue Planet,https://www.imdb.com/title/tt0296310/?ref_=chttvtp_i_28,2001
54m,9.3,156K,10,,"The rise and fall of Harshad Mehta, a stockbroker who single-handedly took the stock market to great heights, is depicted.",Scam 1992: The Harshad Mehta Story,https://www.imdb.com/title/tt12392504/?ref_=chttvtp_i_26,2020
,9.2,33K,10,,"When a mysterious European ship is found marooned in a nearby fishing village, Lord Yoshii Toranaga discovers secrets that could tip the scales of power and devastate his enemies.",Shōgun,https://www.imdb.com/title/tt2788316/?ref_=chttvtp_i_25,2024
24m,9.1,502K,98,4,"After his hometown is destroyed and is traumatized, young Eren Jaeger vows to cleanse the earth of the giant humanoid Titans that have brought humanity to the brink of extinction.",Attack on Titan,https://www.imdb.com/title/tt2560140/?ref_=chttvtp_i_24,2013–2023
16h 30m,9.1,28K,10,,A comprehensive history of the United States' involvement in the bitterly divisive armed conflict in Southeast Asia.,The Vietnam War,https://www.imdb.com/title/tt1877514/?ref_=chttvtp_i_22,2017
23m,9.0,116K,85,4,The Dark Knight battles crime in Gotham City with occasional help from Robin and Batgirl.,Batman: The Animated Series,https://www.imdb.com/title/tt0103359/?ref_=chttvtp_i_23,1992–1995
1h 28m,9.1,992K,15,4,"The quirky spin on Conan Doyle's iconic sleuth pitches him as a ""high-functioning sociopath"" in modern-day London. Assisting him in his investigations: Afghanistan War vet John Watson, who's...",Sherlock,https://www.imdb.com/title/tt1475582/?ref_=chttvtp_i_21,2010–2017
51m,9.1,93K,156,5,"Ordinary people find themselves in extraordinarily astounding situations, which they each try to solve in a remarkable manner.",The Twilight Zone,https://www.imdb.com/title/tt0052520/?ref_=chttvtp_i_20,1959–1964
8h 58m,9.4,219K,11,,"A documentary series on the wildlife found on Earth. Each episode covers a different habitat: deserts, mountains, deep oceans, shallow seas, forests, caves, polar regions, fresh water, plain...",Planet Earth,https://www.imdb.com/title/tt0795176/?ref_=chttvtp_i_3,2006
9h 54m,9.4,522K,10,,"The story of Easy Company of the U.S. Army 101st Airborne Division and their mission in World War II Europe, from Operation Overlord to V-J Day.",Band of Brothers,https://www.imdb.com/title/tt0185906/?ref_=chttvtp_i_4,2001
,9.5,157K,6,,David Attenborough returns with a new wildlife documentary that shows life in a variety of habitats.,Planet Earth II,https://www.imdb.com/title/tt5491994/?ref_=chttvtp_i_2,2016
24m,8.6,44K,37,3,"A psychic middle school boy tries to live a normal life and keep his growing powers under control, even though he constantly gets into trouble.",Mob Psycho 100,https://www.imdb.com/title/tt5897304/?ref_=chttvtp_i_204,2016–2022
30m,8.7,13K,357,8,"The misadventures of a poor, homeless, fumbling boy and his friends in their humble neighborhood.",El Chavo del Ocho,https://www.imdb.com/title/tt0229889/?ref_=chttvtp_i_174,1972–1983
30m,8.6,36K,78,3,TV series featuring the classic Looney Tunes animated shorts.,The Bugs Bunny Show,https://www.imdb.com/title/tt0053488/?ref_=chttvtp_i_173,1960–1975
1h,8.7,148K,63,5,A chronicle of the lives of a dysfunctional family who run an independent funeral home in Los Angeles.,Six Feet Under,https://www.imdb.com/title/tt0248654/?ref_=chttvtp_i_85,2001–2005
24m,8.8,87K,291,,"The adventures of Earth's martial arts defender, Son Goku, continue with a new family and the revelation of his alien origins. Now Goku and his allies must defend the planet from an onslaugh...",Dragon Ball Z,https://www.imdb.com/title/tt0121220/?ref_=chttvtp_i_73,1989–1996
,8.8,153K,18,,A high school mathlete starts hanging out with a group of burnouts while her younger brother navigates his freshman year.,Freaks and Geeks,https://www.imdb.com/title/tt0193676/?ref_=chttvtp_i_67,1999–2000
