episode_length,mark,marks_nb,nb_episodes,nb_seasons,synopsis,title,url,years
45m,9.5,2.1M,62,5,A chemistry teacher diagnosed with inoperable lung cancer turns to manufacturing and selling methamphetamine with a former student in order to secure his family's future.,Breaking Bad,https://www.imdb.com/title/tt0903747/?ref_=chttvtp_i_1,2008–2013
55m,9.2,2.3M,74,8,"Nine noble families fight for control over the lands of Westeros, while an ancient enemy returns after being dormant for a millennia.",Game of Thrones,https://www.imdb.com/title/tt0944947/?ref_=chttvtp_i_13,2011–2019
,9.2,28K,26,,"A groundbreaking 26-part documentary series narrated by the actor Laurence Olivier about the deadliest conflict in history, World War II.",The World at War,https://www.imdb.com/title/tt0071075/?ref_=chttvtp_i_14,1973–1974
7m,9.4,25K,173,3,The slice-of-life adventures of an Australian Blue Heeler Cattle Dog puppy as she has fun with her family and friends in everyday situations.,Bluey,https://www.imdb.com/title/tt7678620/?ref_=chttvtp_i_15,2018– 
23m,9.1,597K,74,10,The fractured domestic lives of a nihilistic mad scientist and his anxious grandson are further complicated by their inter-dimensional misadventures.,Rick and Morty,https://www.imdb.com/title/tt2861424/?ref_=chttvtp_i_16,2013– 
7h 53m,9.1,43K,11,,David Attenborough's legendary BBC crew explains and shows wildlife all over planet earth. From giving an overview of the challenges facing life to hunting the deep sea and various major evo...,Life,https://www.imdb.com/title/tt1533395/?ref_=chttvtp_i_18,2009
8h 11m,9.1,150K,10,,"Led by Michael Jordan, the 1990s Chicago Bulls establish themselves as one of the most notable dynasties in sports history.",The Last Dance,https://www.imdb.com/title/tt8420184/?ref_=chttvtp_i_19,2020
50m,9.3,50K,12,2,"Explores and unravels the mystery of how and why animals migrate, showing some of the most dramatic and compelling stories in the natural world through spectacular and innovative cinematogra...",Our Planet,https://www.imdb.com/title/tt9253866/?ref_=chttvtp_i_12,2019–2023
,9.3,44K,13,,Astronomer Carl Sagan leads us on an engaging guided tour of the various elements and cosmological theories of the universe.,Cosmos,https://www.imdb.com/title/tt0081846/?ref_=chttvtp_i_11,1980
9h 17m,9.3,128K,13,,An exploration of our discovery of the laws of nature and coordinates in space and time.,Cosmos: A Spacetime Odyssey,https://www.imdb.com/title/tt2395695/?ref_=chttvtp_i_10,2014
55m,9.2,465K,86,6,"New Jersey mob boss Tony Soprano deals with personal and professional issues in his home and business life that affect his mental state, leading him to seek professional psychiatric counseli...",The Sopranos,https://www.imdb.com/title/tt0141842/?ref_=chttvtp_i_9,1999–2007
23m,9.3,366K,62,3,"In a war-torn world of elemental magic, a young boy reawakens to undertake a dangerous mystic quest to fulfill his destiny as the Avatar, and bring peace to the world.",Avatar: The Last Airbender,https://www.imdb.com/title/tt0417299/?ref_=chttvtp_i_7,2005–2008
6h 4m,9.3,46K,7,,"David Attenborough returns to the world's oceans in this sequel to the acclaimed documentary filming rare and unusual creatures of the deep, as well as documenting the problems our oceans fa...",Blue Planet II,https://www.imdb.com/title/tt6769208/?ref_=chttvtp_i_8,2017
24m,9.1,195K,68,,Two brothers search for a Philosopher's Stone after an attempt to revive their deceased mother goes awry and leaves them in damaged physical forms.,Fullmetal Alchemist: Brotherhood,https://www.imdb.com/title/tt1355642/?ref_=chttvtp_i_17,2009–2010
59m,9.3,374K,60,5,"The Baltimore drug scene, as seen through the eyes of drug dealers and law enforcement.",The Wire,https://www.imdb.com/title/tt0306414/?ref_=chttvtp_i_6,2002–2008
,9.3,856K,5,,"In April 1986, the city of Chernobyl in the Soviet Union suffers one of the worst nuclear disasters in the history of mankind. Consequently, many heroes put their lives on the line in the fo...",Chernobyl,https://www.imdb.com/title/tt7366338/?ref_=chttvtp_i_5,2019
22m,8.5,35K,56,4,Brothers Huey and Riley Freeman experience a culture clash when they leave Chicago to move in with their grandfather in the suburbs.,The Boondocks,https://www.imdb.com/title/tt0373732/?ref_=chttvtp_i_250,2005–2014
25m,8.5,19K,268,7,"Series of unrelated short stories covering elements of crime, horror, drama, and comedy about people of different backgrounds committing murders, suicides, thefts, and other sorts of crime c...",Alfred Hitchcock Presents,https://www.imdb.com/title/tt0047708/?ref_=chttvtp_i_249,1955–1962
25m,8.7,15K,375,8,"In an era where aliens have invaded and taken over feudal Tokyo, an unemployed samurai finds work however he can.",Gintama,https://www.imdb.com/title/tt0988818/?ref_=chttvtp_i_247,2005–2021
1h 30m,8.6,18K,28,8,"As WWII rages, DCS Foyle fights his own war on the home-front; investigating crime on the south coast of England. Later series, see the retired detective working as an MI5 agent in the after...",Foyle's War,https://www.imdb.com/title/tt0310455/?ref_=chttvtp_i_248,2002–2015
23m,8.5,37K,25,,A piano prodigy who lost his ability to play after suffering a traumatic event in his childhood is forced back into the spotlight by an eccentric girl with a secret of her own.,Your Lie in April,https://www.imdb.com/title/tt3895150/?ref_=chttvtp_i_246,2014–2018
1h 20m,8.8,17K,30,2,"Set in a fictional country called Daeho, it is about the love and growth of young mages as they overcome their twisted fates due to a forbidden magic spell known as the ""alchemy of souls"", w...",Alchemy of Souls,https://www.imdb.com/title/tt20859920/?ref_=chttvtp_i_244,2022– 
50m,8.5,17K,30,6,"Chef's Table goes inside the lives and kitchens of six of the world's most renowned international chefs. Each episode focuses on a single chef and their unique look at their lives, talents a...",Chef's Table,https://www.imdb.com/title/tt4295140/?ref_=chttvtp_i_245,2015–2019
22m,8.5,292K,110,6,A suspended lawyer is forced to enroll in a community college with an eccentric staff and student body.,Community,https://www.imdb.com/title/tt1439629/?ref_=chttvtp_i_242,2009–2015
,8.6,21K,190,6,The life and times of the rather traditional Sutcuoglu family and their comedic struggles to adapt the high-profile contemporary life of Nisantasi.,Avrupa Yakasi,https://www.imdb.com/title/tt0421291/?ref_=chttvtp_i_241,2004–2009
20m,8.6,12K,6,,A cartoonist in Rome with his armadillo-for-a-conscience reflects on his path in life and a would-be love as he and his friends travel outside the city.,Tear Along the Dotted Line,https://www.imdb.com/title/tt15614372/?ref_=chttvtp_i_243,2021
45m,8.6,24K,100,9,The confronting look into the lives of the inmates and prison staff of Wentworth Correctional Centre as they navigate the ups and downs of their lives in the prison system.,Wentworth,https://www.imdb.com/title/tt2433738/?ref_=chttvtp_i_238,2013–2021
1h,8.6,18K,25,4,A woman recounts the lifelong friendship and conflicts with a girl she met at primary school in Naples during the early 1950s.,My Brilliant Friend,https://www.imdb.com/title/tt7278862/?ref_=chttvtp_i_240,2018– 
45m,8.7,11K,21,3,"Umbre follows Relu, an enforcer for a small-time mob boss, as he struggles to keep his family in the dark about his job. The secrets Relu keeps become increasingly oppressive and the lies be...",Umbre,https://www.imdb.com/title/tt4269716/?ref_=chttvtp_i_239,2014–2019
,8.5,275K,39,3,Explores the early relationship between renowned psychiatrist Hannibal Lecter and a young FBI criminal profiler who is haunted by his ability to empathize with serial killers.,Hannibal,https://www.imdb.com/title/tt2243973/?ref_=chttvtp_i_236,2013–2015
30m,8.5,57K,19,3,The personal exploits of a 16-year-old girl and her family and friends during the Troubles in the early 1990s in Northern Ireland.,Derry Girls,https://www.imdb.com/title/tt7120662/?ref_=chttvtp_i_232,2018–2022
24m,8.5,77K,51,,"When a failed alchemical ritual leaves brothers Edward and Alphonse Elric with severely damaged bodies, they begin searching for the one thing that can save them: the fabled philosopher's st...",Fullmetal Alchemist,https://www.imdb.com/title/tt0421357/?ref_=chttvtp_i_229,2003–2004
1h,8.6,13K,12,,Dramatized portrayal of the Apollo manned space program.,From the Earth to the Moon,https://www.imdb.com/title/tt0120570/?ref_=chttvtp_i_231,1998
1h 58m,8.6,16K,4,,"In the era of Japan's Meiji Restoration, an assassin regains his humanity.",Rurouni Kenshin: Trust and Betrayal,https://www.imdb.com/title/tt0203082/?ref_=chttvtp_i_234,1999
30m,8.5,26K,7,2,Nathan Fielder gives people a chance to rehearse for their own lives in a world where nothing ever works out as expected.,The Rehearsal,https://www.imdb.com/title/tt10802170/?ref_=chttvtp_i_235,2022– 
1h,8.5,171K,62,6,"The disappearance of rich-girl-turned-political-activist links the lives of Ceres detective, accidental ship captain and U.N. politician. Amidst political tension between Earth, Mars and the...",The Expanse,https://www.imdb.com/title/tt3230854/?ref_=chttvtp_i_233,2015–2022
1h 15m,8.6,26K,16,,"Due to her 164 I.Q., impressive memory and creative thought process, autistic 27-year-old lawyer Woo Young Woo graduated at the top of her class from a prestigious law school.",Extraordinary Attorney Woo,https://www.imdb.com/title/tt20869502/?ref_=chttvtp_i_230,2022
22m,8.5,144K,80,6,"After being a victim of fraud, Johnny Rose and his family go from extremely wealthy to penniless overnight. The only asset left to them is a small, unsophisticated town: Schitt's Creek. They...",Schitt's Creek,https://www.imdb.com/title/tt3526078/?ref_=chttvtp_i_227,2015–2020
45m,8.6,245K,175,13,The further adventures in time and space of the alien adventurer known as the Doctor and his companions from planet Earth.,Doctor Who,https://www.imdb.com/title/tt0436992/?ref_=chttvtp_i_226,2005–2022
30m,8.6,29K,81,12,"Quick-witted, fast-paced snappy comedy about rural folk getting by in a small town.",Letterkenny,https://www.imdb.com/title/tt4647692/?ref_=chttvtp_i_224,2016–2023
22m,8.5,260K,180,14,"Philip J. Fry, a pizza delivery boy, is accidentally frozen in 1999 and thawed out on New Year's Eve 2999.",Futurama,https://www.imdb.com/title/tt0149460/?ref_=chttvtp_i_228,1999– 
23m,8.5,57K,244,8,The surreal misadventures of two best friends - a blue jay and a raccoon - as they seek to liven up their mundane jobs as groundskeepers at the local park.,Regular Show,https://www.imdb.com/title/tt1710308/?ref_=chttvtp_i_223,2010–2017
3h 55m,8.6,35K,4,,"North and South is a four-part adaptation of Elizabeth Gaskell's love story of Margaret Hale, a middle-class southerner who is forced to move to the northern town of Milton.",North & South,https://www.imdb.com/title/tt0417349/?ref_=chttvtp_i_222,2004
1h 2m,8.5,531K,36,4,"At the intersection of the near future and the reimagined past, waits a world in which every human appetite can be indulged without consequence.",Westworld,https://www.imdb.com/title/tt0475784/?ref_=chttvtp_i_237,2016–2022
5h 31m,8.5,145K,6,,"In the time before the arrival of Spartacus, the House of Batiatus faces many challenges from competitors, and within its own household.",Spartacus: Gods of the Arena,https://www.imdb.com/title/tt1758429/?ref_=chttvtp_i_221,2011
30m,8.6,38K,43,4,"The story of young teenagers and pupils on Hartvig Nissens upper secondary school in Oslo, and their troubles, scandals and everyday life. Each season is told from a different person's point...",Skam,https://www.imdb.com/title/tt5288312/?ref_=chttvtp_i_220,2015–2017
30m,8.5,50K,106,12,Three petty felons have a documentary made about their life in a trailer park.,Trailer Park Boys,https://www.imdb.com/title/tt0290988/?ref_=chttvtp_i_218,2001–2018
46m,8.5,282K,134,11,"A scrappy, feisty, fiercely loyal Chicago family makes no apologies.",Shameless,https://www.imdb.com/title/tt1586680/?ref_=chttvtp_i_217,2011–2021
,8.5,75K,18,,Picks up 25 years after the inhabitants of a quaint northwestern town are stunned when their homecoming queen is murdered.,Twin Peaks,https://www.imdb.com/title/tt4093826/?ref_=chttvtp_i_216,2017
25m,8.6,12K,7,2,"Controversial spoof of current affairs television, and the role of celebrity in the UK.",Brass Eye,https://www.imdb.com/title/tt0118273/?ref_=chttvtp_i_219,1997–2001
28m,8.5,165K,53,6,"Follows the struggle of Richard Hendricks, a Silicon Valley engineer trying to build his own company called Pied Piper.",Silicon Valley,https://www.imdb.com/title/tt2575988/?ref_=chttvtp_i_225,2014–2019
24m,8.5,84K,26,,A teenage boy finds himself recruited as a member of an elite team of pilots by his father.,Neon Genesis Evangelion,https://www.imdb.com/title/tt0112159/?ref_=chttvtp_i_215,1995–1996
45m,8.6,321K,92,7,A biker struggles to balance being a father and being involved in an outlaw motorcycle club.,Sons of Anarchy,https://www.imdb.com/title/tt1124373/?ref_=chttvtp_i_214,2008–2014
1h,8.6,18K,62,8,"Hosted by Morgan Freeman, Through the Wormhole will explore the deepest mysteries of existence - the questions that have puzzled mankind for eternity. What are we made of? What was there bef...",Through the Wormhole,https://www.imdb.com/title/tt1513168/?ref_=chttvtp_i_213,2010–2017
,8.5,64K,18,3,Yorkshire-based crime drama centering on the personal and professional life of Police Sergeant Catherine Cawood.,Happy Valley,https://www.imdb.com/title/tt3428912/?ref_=chttvtp_i_211,2014–2023
40m,8.5,50K,60,6,Docuseries following the FIA Formula One World Championship across multiple seasons.,Formula 1: Drive to Survive,https://www.imdb.com/title/tt8289930/?ref_=chttvtp_i_210,2019– 
,8.5,123K,14,3,The story of an office that faces closure when the company decides to downsize its branches. A documentary film crew follow staff and the manager David Brent as they continue their daily liv...,The Office,https://www.imdb.com/title/tt0290978/?ref_=chttvtp_i_212,2001–2003
30m,8.6,76K,24,3,Teens Charlie and Nick discover their unlikely friendship might be something more as they navigate school and young love in this coming-of-age series.,Heartstopper,https://www.imdb.com/title/tt10638036/?ref_=chttvtp_i_208,2022– 
55m,8.5,256K,33,3,"The life of Spartacus, the gladiator who lead a rebellion against the Romans. From his time as an ally of the Romans, to his betrayal and becoming a gladiator, to the rebellion he leads and ...",Spartacus,https://www.imdb.com/title/tt1442449/?ref_=chttvtp_i_209,2010–2013
30m,8.5,46K,220,8,Improvisational comedy competition show in which four members of the regular cast as comedians and often with guest appearances with other comedians and celebrities and members of the audien...,Whose Line Is It Anyway?,https://www.imdb.com/title/tt0163507/?ref_=chttvtp_i_207,1998–2007
22m,8.5,82K,61,5,"The life of Louie C.K., a divorced comedian living in New York with two kids.",Louie,https://www.imdb.com/title/tt1492966/?ref_=chttvtp_i_205,2010–2015
30m,8.6,21K,20,3,"The lives of two eccentric metal detectorists, who spend their days plodding along ploughed tracks and open fields, hoping to disturb the tedium by unearthing the fortune of a lifetime.",Detectorists,https://www.imdb.com/title/tt4082744/?ref_=chttvtp_i_206,2014–2022
23m,8.5,59K,62,5,"A samurai, sent through time, fights to return home and save the world.",Samurai Jack,https://www.imdb.com/title/tt0278238/?ref_=chttvtp_i_203,2001–2017
29m,8.6,22K,12,2,"A failed television presenter, now presenting a programme on local desperately tries to revive his broadcasting career.",I'm Alan Partridge,https://www.imdb.com/title/tt0129690/?ref_=chttvtp_i_201,1997–2002
1h 30m,8.7,37K,71,2,"Betrayed by his trusted friends and the woman he loved, Ömer Uçar returns as Ezel to exact his vengeance.",Ezel,https://www.imdb.com/title/tt1534360/?ref_=chttvtp_i_200,2009–2011
5h 15m,8.6,15K,10,,"Ewan McGregor and Charley Boorman embark on a grueling quest to motorbike from London to New York. Going east through Europe, Asia and then to Alaska, they experience different cultures and ...",Long Way Round,https://www.imdb.com/title/tt0403778/?ref_=chttvtp_i_202,2004–2010
25m,8.5,57K,14,2,"Friends Tim and Daisy, 20-something North Londoners with uncertain futures, must pretend to be a couple to live in the only apartment they can afford.",Spaced,https://www.imdb.com/title/tt0187664/?ref_=chttvtp_i_199,1999–2001
25m,8.5,164K,25,5,"The comedic misadventures of Roy, Moss and their grifting supervisor Jen, a rag-tag team of IT support workers at a large corporation headed by a hotheaded yuppie.",The IT Crowd,https://www.imdb.com/title/tt0487831/?ref_=chttvtp_i_197,2006–2013
11m,8.6,22K,69,6,"Eric Andre tries to host a talk show in a bizarre environment, where he is sometimes the player of pranks and sometimes the victim.",The Eric Andre Show,https://www.imdb.com/title/tt2244495/?ref_=chttvtp_i_196,2012– 
30m,8.6,45K,284,10,"Q, Sal, Joe and Murr are real-life best friends who love challenging each other to the most outrageous dares and stunts ever caught on hidden camera.",Impractical Jokers,https://www.imdb.com/title/tt2100976/?ref_=chttvtp_i_194,2011– 
49m,8.5,416K,45,4,"Elliot, a brilliant but unstable cyber-security engineer and vigilante hacker, becomes a key figure in a complex game of global chaos when he and his shadowy allies try to take down the corr...",Mr. Robot,https://www.imdb.com/title/tt4158110/?ref_=chttvtp_i_198,2015–2019
1h,8.9,12K,20,2,"A historical fiction drama and thriller set in the turbulent period of the late 1920s in the Balkans as a place where high politics, local interests, capital and crime all merge together.",Black Sun,https://www.imdb.com/title/tt6108262/?ref_=chttvtp_i_193,2017– 
1h 29m,8.6,33K,36,9,"Set from 1965 into the 1970s, the show follows Endeavour Morse in his early years as a police constable. Working alongside his senior partner DI Fred Thursday, Morse engages in a number of i...",Endeavour,https://www.imdb.com/title/tt2701582/?ref_=chttvtp_i_195,2012–2023
30m,8.6,13K,16,2,James Hacker was propelled along the corridors of power to the very pinnacle of politics - Number 10.,"Yes, Prime Minister",https://www.imdb.com/title/tt0086831/?ref_=chttvtp_i_191,1986–1987
24m,8.6,55K,26,,"Fuu, a waitress who works in a teahouse, rescues two master swordsmen, Mugen and Jin, from their execution to help her find the ""samurai who smells of sunflowers.""",Samurai Champloo,https://www.imdb.com/title/tt0423731/?ref_=chttvtp_i_192,2004–2005
,8.9,18K,17,2,"The story of two extraordinary men, Dr. Homi Jehangir Bhabha and Dr. Vikram Ambalal Sarabhai, who created history while building India's future.",Rocket Boys,https://www.imdb.com/title/tt13868972/?ref_=chttvtp_i_190,2022– 
30m,8.6,48K,28,4,Six best friends talk about all aspects of sex and relationships on their never-ending quest to find true love.,Coupling,https://www.imdb.com/title/tt0237123/?ref_=chttvtp_i_189,2000–2004
1h,8.5,102K,20,2,"Filmed over a 10-year period, Steven Avery, a DNA exoneree who, while in the midst of exposing corruption in local law enforcement, finds himself the prime suspect in a grisly new crime.",Making a Murderer,https://www.imdb.com/title/tt5189670/?ref_=chttvtp_i_188,2015–2018
24m,8.5,65K,153,9,"Dragon Ball tells the tale of a young warrior by the name of Son Goku, a young peculiar boy with a tail who embarks on a quest to become stronger and learns of the Dragon Balls, when, once a...",Dragon Ball,https://www.imdb.com/title/tt0280249/?ref_=chttvtp_i_186,1995–2003
3h 3m,8.5,80K,2,,"Following the destruction of the Twelve Colonies of Kobol by the Cylons, a rag-tag fugitive fleet of the last remnants of mankind flees the pursuing Cylons while simultaneously searching for...",Battlestar Galactica,https://www.imdb.com/title/tt0314979/?ref_=chttvtp_i_184,2003
45m,8.7,98K,20,3,"A working man from the National Investigation Agency tries to protect the nation from terrorism, but he also needs to keep his family safe from his secret job.",The Family Man,https://www.imdb.com/title/tt9544034/?ref_=chttvtp_i_185,2019– 
,8.5,546K,7,,"Orphaned at the tender age of nine, prodigious introvert Beth Harmon discovers and masters the game of chess in 1960s USA. But child stardom comes at a price.",The Queen's Gambit,https://www.imdb.com/title/tt10048342/?ref_=chttvtp_i_183,2020
24m,8.6,109K,48,3,A boy swallows a cursed talisman - the finger of a demon - and becomes cursed himself. He enters a shaman's school to be able to locate the demon's other body parts and thus exorcise himself...,Jujutsu Kaisen,https://www.imdb.com/title/tt12343534/?ref_=chttvtp_i_182,2020– 
22m,8.6,28K,86,7,"The bizarre escapades of pseudo-heroic scientist Dr. Rusty Venture, his competent, high-strung bodyguard, and his two overenthusiastic sons.",The Venture Bros.,https://www.imdb.com/title/tt0417373/?ref_=chttvtp_i_181,2003–2018
25m,8.5,65K,153,,"Son Gokû, a fighter with a monkey tail, goes on a quest with an assortment of odd characters in search of the Dragon Balls, a set of crystals that can give its bearer anything they desire.",Dragon Ball,https://www.imdb.com/title/tt0088509/?ref_=chttvtp_i_180,1986–1989
28m,8.6,66K,22,2,"Bret and Jemaine are Flight of the Conchords, a folk-rock band from New Zealand living in New York City in search of stardom.",Flight of the Conchords,https://www.imdb.com/title/tt0863046/?ref_=chttvtp_i_187,2007–2009
22m,8.6,51K,52,2,Seven of the most formidable heroes form arguably the most powerful team ever.,Justice League,https://www.imdb.com/title/tt0275137/?ref_=chttvtp_i_179,2001–2004
30m,8.6,101K,51,6,A look into the nightly lives of four vampires who have lived together on Staten Island for over a century.,What We Do in the Shadows,https://www.imdb.com/title/tt7908628/?ref_=chttvtp_i_178,2019–2024
1h,8.7,14K,122,7,An American police procedural television series chronicling the work of a fictional version of the Baltimore Police Department's Homicide Unit.,Homicide: Life on the Street,https://www.imdb.com/title/tt0106028/?ref_=chttvtp_i_177,1993–1999
,8.6,286K,10,,"Flashing between past and present, a fractured family confronts haunting memories of their old home and the terrifying events that drove them from it.",The Haunting of Hill House,https://www.imdb.com/title/tt6763664/?ref_=chttvtp_i_176,2018
52m,8.7,14K,50,5,"A very unique and captivating series about the ""bureau des légendes"", the mythical powerhouse within the French Secret Service and its dare devil ghost agents.",The Bureau,https://www.imdb.com/title/tt4063800/?ref_=chttvtp_i_175,2015–2020
,8.6,118K,78,6,"Enforcing his own brand of justice, U.S. Marshal Raylan Givens, a strong-willed, quiet law-man haunted by his past, returns to his native town to see that justice is served to those in need.",Justified,https://www.imdb.com/title/tt1489428/?ref_=chttvtp_i_172,2010–2015
30m,8.6,34K,334,21,"A comedy panel game in which being Quite Interesting is more important than being right. Sandi Toksvig is joined each week by four comedians to share anecdotes and trivia, and maybe answer s...",QI,https://www.imdb.com/title/tt0380136/?ref_=chttvtp_i_170,2003– 
55m,8.6,202K,56,5,An Atlantic City politician plays both sides of the law by conspiring with gangsters during the Prohibition era.,Boardwalk Empire,https://www.imdb.com/title/tt0979432/?ref_=chttvtp_i_171,2010–2014
1h,8.7,215K,53,5,A ranching family in Montana faces off against others encroaching on their land.,Yellowstone,https://www.imdb.com/title/tt4236770/?ref_=chttvtp_i_169,2018– 
55m,8.6,124K,25,3,"A newsroom undergoes some changes in its workings and morals as a new team is brought in, bringing unexpected results for its existing news anchor.",The Newsroom,https://www.imdb.com/title/tt1870479/?ref_=chttvtp_i_168,2012–2014
35m,8.6,205K,19,3,A young chef from the fine dining world returns to Chicago to run his family's sandwich shop.,The Bear,https://www.imdb.com/title/tt14452776/?ref_=chttvtp_i_167,2022– 
,8.7,11K,10,,A series of colorized archive footage of important events during World War II.,Greatest Events of WWII in Colour,https://www.imdb.com/title/tt9103932/?ref_=chttvtp_i_165,2019
30m,8.6,29K,26,3,"Ray Shoesmith is a father, ex-husband, boyfriend, brother and best friend, tough roles to juggle in the modern age. Especially when you're also a criminal for hire.",Mr Inbetween,https://www.imdb.com/title/tt7472896/?ref_=chttvtp_i_166,2018–2021
,8.6,76K,8,,"The series takes viewers to the epicenter of America's struggle with opioid addiction, from the boardrooms of Purdue Pharma, to a distressed Virginia mining community, to the hallways of the...",Dopesick,https://www.imdb.com/title/tt9174558/?ref_=chttvtp_i_163,2021
23m,8.6,45K,102,4,Teenage superheroes strive to prove themselves as members of the Justice League.,Young Justice,https://www.imdb.com/title/tt1641384/?ref_=chttvtp_i_162,2010–2023
1h,8.6,66K,27,3,"The adventures of a young orphan girl living in the late 19th century. Follow Anne as she learns to navigate her new life on Prince Edward Island, in this new take on L.M. Montgomery's class...",Anne with an E,https://www.imdb.com/title/tt5421602/?ref_=chttvtp_i_161,2017–2019
30m,8.7,16K,22,3,The Right Honorable James Hacker has landed the plum job of Cabinet Minister to the Department of Administration. At last he is in a position of power and can carry out some long-needed refo...,Yes Minister,https://www.imdb.com/title/tt0080306/?ref_=chttvtp_i_164,1980–1984
24m,8.7,14K,12,,The crew of a damaged deep space freighter strands on a beautiful but dangerous planet.,Scavengers Reign,https://www.imdb.com/title/tt21056886/?ref_=chttvtp_i_160,2023
